{
  "globalSequence": 12,
  "categoryPositions": {
    "default": {
      "lastModelId": "openai/gpt-4.1-mini",
      "sequenceInCategory": 5,
      "modelsInPool": [
        "ollama/kimi-k2.5:cloud",
        "ollama/gemma3:4b",
        "ollama/gpt-oss:120b-cloud",
        "google/gemini-2.0-flash",
        "openai/gpt-4.1-mini"
      ]
    },
    "code": {
      "lastModelId": "ollama/kimi-k2.5:cloud",
      "sequenceInCategory": 5,
      "modelsInPool": [
        "openai/codex-mini-latest",
        "ollama/kimi-k2.5:cloud",
        "ollama/gpt-oss:120b-cloud"
      ]
    },
    "reasoning": {
      "lastModelId": "ollama/kimi-k2.5:cloud",
      "sequenceInCategory": 1,
      "modelsInPool": [
        "ollama/kimi-k2.5:cloud",
        "ollama/gpt-oss:120b-cloud",
        "openai/gpt-4-turbo"
      ]
    },
    "vision": {
      "lastModelId": "ollama/kimi-k2.5:cloud",
      "sequenceInCategory": 1,
      "modelsInPool": [
        "ollama/kimi-k2.5:cloud",
        "ollama/gemma3:4b",
        "google/gemini-2.0-flash"
      ]
    }
  },
  "modelHealth": {
    "ollama/kimi-k2.5:cloud": {
      "lastUsed": "2026-02-03T02:53:31.082Z",
      "successCount": 1,
      "failureCount": 3,
      "avgResponseTime": 0,
      "lastFailure": "2026-02-03T02:53:31.067Z",
      "consecutiveFailures": 0,
      "isHealthy": true
    }
  },
  "usageStats": {
    "daily": {
      "requestsByModel": {
        "ollama/kimi-k2.5:cloud": 5,
        "openai/codex-mini-latest": 2,
        "ollama/gpt-oss:120b-cloud": 2,
        "ollama/gemma3:4b": 1,
        "openai/gpt-4.1-mini": 2
      },
      "tokensByModel": {},
      "errorsByModel": {}
    }
  },
  "schemaVersion": "1.0",
  "lastUpdated": "2026-02-03T02:53:31.090Z"
}