{
  "globalSequence": 0,
  "categoryPositions": {
    "default": {
      "lastModelId": "",
      "sequenceInCategory": 0,
      "modelsInPool": [
        "ollama/kimi-k2.5:cloud",
        "ollama/qwen2.5:14b",
        "google/gemini-2.0-flash"
      ]
    },
    "reasoning": {
      "lastModelId": "",
      "sequenceInCategory": 0,
      "modelsInPool": [
        "ollama/kimi-k2.5:cloud",
        "ollama/deepseek-r1:14b"
      ]
    },
    "vision": {
      "lastModelId": "",
      "sequenceInCategory": 0,
      "modelsInPool": [
        "ollama/kimi-k2.5:cloud",
        "ollama/gemma3:4b",
        "google/gemini-2.0-flash"
      ]
    },
    "code": {
      "lastModelId": "",
      "sequenceInCategory": 0,
      "modelsInPool": [
        "ollama/qwen2.5:14b",
        "ollama/kimi-k2.5:cloud"
      ]
    }
  },
  "modelHealth": {},
  "usageStats": {
    "daily": {
      "requestsByModel": {},
      "tokensByModel": {},
      "errorsByModel": {}
    }
  },
  "schemaVersion": "1.0",
  "lastUpdated": "2026-02-02T19:30:00Z"
}